"product_id","name","description","price","stock","img"
1,"Sangria","Ethnic Motifs Printed V-Neck Straight Kurta With Trouser","1119.00",100,"https://i.etsystatic.com/22368382/r/il/d5e4c5/4269322241/il_570xN.4269322241_60k9.jpg"
2,"Kalini","Ethnic Motifs Embroidered Thread Work Cotton Straight Kurta","690.00",200,"https://m.media-amazon.com/images/I/81YuqIDBj9L._AC_UY1100_.jpg"
3,"Louis Philippe","Printed Classic Pure Cotton Formal Shirt","1400.00",60,"https://assets.myntassets.com/w_412,q_60,dpr_2,fl_progressive/assets/images/25802498/2023/11/30/d68588c6-b133-411a-a01d-fe1e4a15b1ef1701344879221-Louis-Philippe-AthWork-Men-Shirts-2271701344878773-1.jpg"
4,"Levis","Men 513 Straight Fit Light Fade Stretchable Jeans","3849.00",80,"https://rukminim2.flixcart.com/image/850/1000/xif0q/jean/c/d/r/32-18298-1263-levi-s-original-imaget8kkkfhwezb-bb.jpeg?q=90&crop=false"
5,"Marks & Spencer","Girls Square Neck Sleeveless Gathered A-Line Pure Cotton Top","599.00",120,"https://assets.myntassets.com/h_1440,q_100,w_1080/v1/assets/images/23580264/2023/6/9/3175b48b-8410-4583-b5ef-4731942865701686309361547MarksSpencerPurpleStripedCottonTop1.jpg"
6,"United Colors of Benetton","Boys Pure Cotton Regular Fit Shirt","610.00",70,"https://assets.myntassets.com/w_412,q_60,dpr_2,fl_progressive/assets/images/27260198/2024/4/3/eb2e3134-2791-4bbb-94b4-14e7ebaa65f71712144538627-United-Colors-of-Benetton-Boys-Pure-Cotton-Regular-Fit-Shirt-1.jpg"
7,"Azira","Floral Print Mandarin Collar Puff Sleeve Cotton Peplum Top","700.00",300,"https://assets.myntassets.com/h_1440,q_100,w_1080/v1/assets/images/27444018/2024/3/23/abd46d27-4775-411b-b3e4-37d2fdf5b6e11711174676396-Azira-Floral-Print-Mandarin-Collar-Puff-Sleeve-Cotton-Peplum-11.jpg"
8,"Inddus","Floral Embroidered Sequinned Saree","1619.00",75,"https://www.inddus.in/cdn/shop/products/floral-embroidered-sequinned-saree-997441.jpg?v=1696663064"
